{
  "format": "hyper-deployment-request",
  "format_version": 1,
  "device_id": "10000000-0000-4000-8000-000000000001",
  "client_id": "20000000-0000-4000-8000-000000000001",
  "request_id": "40000000-0000-4000-8000-000000000001",
  "sequence": 1,
  "operation": "deploy",
  "bundle_sha256": "aaaaaaaaaaaaaaaaaaaaaaaaaaaaaaaaaaaaaaaaaaaaaaaaaaaaaaaaaaaaaaaa",
  "bundle_byte_length": 1048576,
  "runtime_version": "1.0.0",
  "issued_at_epoch_ms": 1785153600000,
  "expires_at_epoch_ms": 1785153660000,
  "signature": "AAAAAAAAAAAAAAAAAAAAAAAAAAAAAAAAAAAAAAAAAAAAAAAAAAAAAAAAAAAAAAAAAAAAAAAAAAAAAAAAAAAAAA",
  "extensions": {}
}
